{
  "schemaVersion": "paramspec-v1",
  "project_name": "Система встроенных шкафов в зоне референтов 3118×600×1800",
  "furniture_type": "система шкафов",
  "archetype": "cabinet",
  "dimensions": {
    "width": 3118,
    "depth": 600,
    "height": 1800,
    "tolerance": 10
  },
  "materials": {
    "board_thickness": 16,
    "board_material": "ЛДСП",
    "back_material": "ХДФ",
    "back_thickness": 3,
    "color": "Бело-серый",
    "color_code": "U775 ST9"
  },
  "legs": {
    "type": "цоколь",
    "height": 100,
    "as_panel": true,
    "adjustable": true,
    "color": "чёрный"
  },
  "sections": [
    {
      "id": "docs1",
      "kind": "door",
      "door": 2,
      "door_name": [
        "Документы 1 дверь левая",
        "Документы 1 дверь правая"
      ],
      "shelves": 4,
      "shelf_label": "Документы 1 полка"
    },
    {
      "id": "docs2",
      "kind": "door",
      "door": 2,
      "door_name": [
        "Документы 2 дверь левая",
        "Документы 2 дверь правая"
      ],
      "shelves": 4,
      "shelf_label": "Документы 2 полка"
    },
    {
      "id": "wardrobe",
      "kind": "door",
      "door": 2,
      "door_name": [
        "Гардероб дверь левая",
        "Гардероб дверь правая"
      ],
      "shelf_levels": [
        316,
        1600,
        1684
      ],
      "shelf_label": "Гардероб полка"
    }
  ],
  "hardware": {
    "handles": {
      "type": "ручка-профиль",
      "material": "металл",
      "color": "чёрный",
      "size": 224,
      "count": 6,
      "offset_from_top": 40
    },
    "hinges": {
      "type": "петля накладная без доводчика"
    }
  },
  "features": [
    "штанга круглая металлическая D25 в гардеробе",
    "полка для обуви 300 мм"
  ],
  "warnings": [
    "3 секции: 2 документов (по 4 полки) + гардероб (штанга+полки). 6 дверей под 2 крышками — в модели одна крышка.",
    "Задник ХДФ холодный серый."
  ],
  "estimated_values": []
}