{
  "schemaVersion": "paramspec-v1",
  "project_name": "Шкаф для документов 1000×400×1800 (зам. директора)",
  "furniture_type": "шкаф для документов",
  "archetype": "cabinet",
  "dimensions": {
    "width": 1000,
    "depth": 400,
    "height": 1800,
    "tolerance": 10
  },
  "materials": {
    "board_thickness": 16,
    "board_material": "ЛДСП",
    "back_material": "ЛДСП",
    "back_thickness": 16,
    "color": "Дуб Денвер трюфель",
    "color_code": "Н 1399 ST 10"
  },
  "legs": {
    "type": "регулируемые опоры",
    "height": 100,
    "adjustable": true,
    "color": "чёрный"
  },
  "sections": [
    {
      "id": "left",
      "kind": "door",
      "shelves": 4,
      "shelf_label": "Полка левая",
      "door": 1,
      "door_name": "Дверь левая"
    },
    {
      "id": "right",
      "kind": "door",
      "shelves": 4,
      "shelf_label": "Полка правая",
      "door": 1,
      "door_name": "Дверь правая"
    }
  ],
  "hardware": {
    "handles": {
      "type": "ручка-профиль",
      "material": "металл",
      "color": "чёрный",
      "size": 224,
      "count": 2,
      "offset_from_top": 40
    },
    "locks": [
      {
        "type": "замок на правую дверь",
        "color": "хром",
        "target": "right_door"
      }
    ]
  },
  "features": [
    "шпингалет"
  ],
  "warnings": [
    "Задник ЛДСП в цвет корпуса (по чертежу). Опоры регулируемые ~100 мм (уточнить)."
  ],
  "estimated_values": []
}