{
  "schemaVersion": "paramspec-v1",
  "project_name": "Шкаф 700×400×500",
  "furniture_type": "шкаф",
  "archetype": "door_unit",
  "dimensions": { "width": 700, "depth": 400, "height": 500, "tolerance": 5 },
  "materials": {
    "board_thickness": 16,
    "back_thickness": 16,
    "board_material": "ЛДСП",
    "back_material": "ЛДСП",
    "edge_band_thickness": 0.4,
    "color": "по согласованию",
    "color_code": ""
  },
  "legs": { "type": "нет", "height": 0 },
  "gaps": { "facade": 2, "default": 2 },
  "sections": [
    { "id": "main", "kind": "door", "shelves": 6, "door": 1 }
  ],
  "hardware": {
    "handles": { "type": "ручка", "material": "металл", "color": "по согласованию", "size": 128, "count": 1, "offset_from_top": 32, "furniture_encoded": "" }
  },
  "warnings": ["6 стационарных полок, без ящиков.", "Петли/присадка — в БАЗИС вручную."],
  "estimated_values": ["materials.color", "shelf spacing округлено"]
}
